[
  {
    "adaptationStatus": "adapted-reviewed",
    "dependencies": [
      "skills/poteto-mode/playbooks/autopilot-full.md",
      "skills/poteto-mode/playbooks/babysit.md",
      "skills/poteto-mode/playbooks/shipping.md",
      "skills/poteto-mode/references/bugbot-triage.md",
      "skills/poteto-mode/SKILL.md",
      "references/agent-prompts/poteto-agent.md",
      "skills/swarm/SKILL.md",
      "skills/no-comments/SKILL.md",
      "skills/principle-prove-it-works/SKILL.md",
      "skills/show-me-your-work/SKILL.md",
      "skills/show-me-your-work/scripts/log.sh",
      "skills/show-me-your-work/references/decision-log-template.tsv",
      "skills/poteto-mode/playbooks/opening-a-pr.md",
      "references/host-capabilities.md",
      "references/orchestration-contract.md",
      "references/model-roles.md",
      "skills/ketchup/SKILL.md"
    ],
    "destinationPath": "skills/poteto-mode/playbooks/autopilot-stack.md",
    "disposition": "runtime",
    "licenseProvenance": {
      "copyright": "Copyright (c) 2026 Lauren Tan",
      "license": "MIT",
      "sourcePath": "LICENSE"
    },
    "rationale": "Adopt dependency branching, root-only topology, explicit lease handoff, shared review cadence, frozen landing chain and ketchup without granting merge authority.",
    "upstreamCommit": "d457567332aa6989e753ea289f30ea2bfbc80bc0",
    "upstreamPath": "skills/poteto-mode/playbooks/autopilot-stack.md",
    "upstreamSha256": "c6bcb18b2ce605e77a2a2225854590a4b9a687911f79331746d91a4fe9a52e60",
    "verification": {
      "chatgpt": {
        "evidence": [],
        "status": "not-run"
      },
      "codex": {
        "evidence": [],
        "status": "not-run"
      }
    }
  }
]
