[
  {
    "adaptationStatus": "adapted-reviewed",
    "dependencies": [
      "skills/principle-prove-it-works/SKILL.md",
      "skills/principle-build-the-lever/SKILL.md",
      "references/host-capabilities.md",
      "references/orchestration-contract.md"
    ],
    "destinationPath": "skills/principle-sequence-verifiable-units/SKILL.md",
    "disposition": "runtime",
    "licenseProvenance": {
      "copyright": "Copyright (c) 2026 Lauren Tan",
      "license": "MIT",
      "sourcePath": "LICENSE"
    },
    "rationale": "Preserve the complete canonical sequencing principle and invocation metadata; bind verification and Git operations to observed capabilities, ownership and authorization. No comparison content or personal preferences added.",
    "upstreamCommit": "4ec7ffa173eaa70d3d9467a627baf0954645a353",
    "upstreamPath": "skills/principle-sequence-verifiable-units/SKILL.md",
    "upstreamSha256": "2ccbbacc56ace5afdfb8670cef19d7bd009fb2a0033b9a741cbdf2b6baf72187",
    "verification": {
      "chatgpt": {
        "evidence": [],
        "status": "not-run"
      },
      "codex": {
        "evidence": [],
        "status": "not-run"
      }
    }
  }
]
