[
  {
    "upstreamPath": "skills/bro/SKILL.md",
    "upstreamCommit": "df581122cde17e6e27686b5a448bde23e4ad4318",
    "upstreamSha256": "aa329d0ceeeecb6822a7174ad76bb07a7826a3c52ceb6a588dec4138815084bb",
    "destinationPath": "skills/bro/SKILL.md",
    "disposition": "runtime",
    "rationale": "Retain the complete canonical skill verbatim. Restatement needs only the previous assistant message; no host tool or API adaptation is required. Missing history is explicit in the acceptance case.",
    "dependencies": [],
    "licenseProvenance": {
      "license": "MIT",
      "copyright": "Copyright (c) 2026 Lauren Tan",
      "sourcePath": "LICENSE"
    },
    "adaptationStatus": "unchanged-reviewed",
    "verification": {
      "chatgpt": {
        "status": "not-run",
        "evidence": []
      },
      "codex": {
        "status": "not-run",
        "evidence": []
      }
    }
  }
]
