[
  {
    "adaptationStatus": "adapted-reviewed",
    "dependencies": [
      "skills/how/SKILL.md",
      "skills/why/SKILL.md",
      "references/model-roles.md",
      "references/host-capabilities.md"
    ],
    "destinationPath": "references/agent-prompts/comment-sicko.md",
    "disposition": "relocated",
    "licenseProvenance": {
      "copyright": "Copyright (c) 2026 Lauren Tan",
      "license": "MIT",
      "sourcePath": "LICENSE"
    },
    "rationale": "Canonical identifier case change has no registered portable agent equivalent. Retain role prompt and existing host-neutral binding.",
    "upstreamCommit": "4ec7ffa173eaa70d3d9467a627baf0954645a353",
    "upstreamPath": "agents/comment-sicko.md",
    "upstreamSha256": "3e239e40b7b4b9beb2cf7f3ccc57f2388eb8b69bd1ba8ae888ef87ef6e0e2116",
    "verification": {
      "chatgpt": {
        "evidence": [],
        "status": "not-run"
      },
      "codex": {
        "evidence": [],
        "status": "not-run"
      }
    }
  },
  {
    "adaptationStatus": "adapted-reviewed",
    "dependencies": [
      "skills/poteto-mode/SKILL.md",
      "references/model-roles.md",
      "references/host-capabilities.md"
    ],
    "destinationPath": "references/agent-prompts/poteto-agent.md",
    "disposition": "relocated",
    "licenseProvenance": {
      "copyright": "Copyright (c) 2026 Lauren Tan",
      "license": "MIT",
      "sourcePath": "LICENSE"
    },
    "rationale": "Delegate-only ownership and exact mode read while preserving portable package discovery and missing dependency behavior.",
    "upstreamCommit": "4ec7ffa173eaa70d3d9467a627baf0954645a353",
    "upstreamPath": "agents/poteto-agent.md",
    "upstreamSha256": "979f18abd000d185a0b4c41a2a4111c0910596a7f5c81cbb571885bc721b2bf7",
    "verification": {
      "chatgpt": {
        "evidence": [],
        "status": "not-run"
      },
      "codex": {
        "evidence": [],
        "status": "not-run"
      }
    }
  }
]
