[
  {
    "adaptationStatus": "adapted-reviewed",
    "dependencies": [
      "skills/principle-laziness-protocol/SKILL.md",
      "skills/principle-encode-lessons-in-structure/SKILL.md",
      "skills/principle-prove-it-works/SKILL.md",
      "references/host-capabilities.md",
      "references/orchestration-contract.md",
      "references/workflow-ownership.md"
    ],
    "destinationPath": "skills/principle-build-the-lever/SKILL.md",
    "disposition": "runtime",
    "licenseProvenance": {
      "copyright": "Copyright (c) 2026 Lauren Tan",
      "license": "MIT",
      "sourcePath": "LICENSE"
    },
    "rationale": "Retain complete current host adaptation; upstream prose consolidation does not add substantive required behavior.",
    "upstreamCommit": "88d47514b82e7c44f00f2b2a72ff6dd12158038c",
    "upstreamPath": "skills/principle-build-the-lever/SKILL.md",
    "upstreamSha256": "3434b0ad0c640c6f1d7960be7a8986c3bcdc14e26060360dec29903df60074ff",
    "verification": {
      "chatgpt": {
        "evidence": [],
        "status": "not-run"
      },
      "codex": {
        "evidence": [],
        "status": "not-run"
      }
    }
  }
]
