[
  {
    "upstreamPath": "skills/technical-writing/SKILL.md",
    "upstreamCommit": "df581122cde17e6e27686b5a448bde23e4ad4318",
    "upstreamSha256": "f5c512ffeec70bc4e0dee50f7bb4c26742e1be77967a6e8b15d1921e1c209ceb",
    "destinationPath": "skills/technical-writing/SKILL.md",
    "disposition": "runtime",
    "rationale": "Preserve the complete canonical layered writing standard, metadata, invocation, examples and output rules. Add session capability and permission boundaries for document reads, saved edits, and the unslop dependency; do not infer host enforcement or behavior.",
    "dependencies": [
      "skills/unslop/SKILL.md",
      "references/host-capabilities.md"
    ],
    "licenseProvenance": {
      "license": "MIT",
      "copyright": "Copyright (c) 2026 Lauren Tan",
      "sourcePath": "LICENSE"
    },
    "adaptationStatus": "adapted-reviewed",
    "verification": {
      "chatgpt": {
        "status": "not-run",
        "evidence": []
      },
      "codex": {
        "status": "not-run",
        "evidence": []
      }
    }
  }
]
