[
  {
    "adaptationStatus": "reference-only-reviewed",
    "dependencies": [],
    "destinationPath": "references/upstream-metadata/plugin.json",
    "disposition": "reference-only",
    "licenseProvenance": {
      "copyright": "Copyright (c) 2026 Lauren Tan",
      "license": "MIT",
      "sourcePath": "LICENSE"
    },
    "rationale": "Retain the new official portable manifest as source provenance; the adapted root manifest keeps the existing port identity and independent version.",
    "upstreamCommit": "99743e9c151c8537cbbf1f98bb38f34ef3368453",
    "upstreamPath": "plugin.json",
    "upstreamSha256": "68f0ddbdda23d1e663b48c881f1b896305a3dcdc320ff83c65dd24cd9ac6850f",
    "verification": {
      "chatgpt": {
        "evidence": [],
        "status": "not-run"
      },
      "codex": {
        "evidence": [],
        "status": "not-run"
      }
    }
  },
  {
    "adaptationStatus": "adapted-reviewed",
    "dependencies": [],
    "destinationPath": "skills/in-your-own-words/SKILL.md",
    "disposition": "runtime",
    "licenseProvenance": {
      "copyright": "Copyright (c) 2026 Lauren Tan",
      "license": "MIT",
      "sourcePath": "LICENSE"
    },
    "rationale": "Add reviewed upstream native-text workflow with explicit scope, capability and authorization limits; invocation metadata is not host enforcement.",
    "upstreamCommit": "99743e9c151c8537cbbf1f98bb38f34ef3368453",
    "upstreamPath": "skills/in-your-own-words/SKILL.md",
    "upstreamSha256": "fa8ba74e27d7be371dc270ec78bbf816411477d0dfab185356c861ac8dd413ad",
    "verification": {
      "chatgpt": {
        "evidence": [],
        "status": "not-run"
      },
      "codex": {
        "evidence": [],
        "status": "not-run"
      }
    }
  },
  {
    "adaptationStatus": "adapted-reviewed",
    "dependencies": [
      "skills/bro/SKILL.md",
      "references/host-capabilities.md"
    ],
    "destinationPath": "skills/ketchup/SKILL.md",
    "disposition": "runtime",
    "licenseProvenance": {
      "copyright": "Copyright (c) 2026 Lauren Tan",
      "license": "MIT",
      "sourcePath": "LICENSE"
    },
    "rationale": "Add reviewed upstream native-text workflow with explicit scope, capability and authorization limits; invocation metadata is not host enforcement.",
    "upstreamCommit": "99743e9c151c8537cbbf1f98bb38f34ef3368453",
    "upstreamPath": "skills/ketchup/SKILL.md",
    "upstreamSha256": "47b3fb0d5626a40fcb3bd016e68f1cb3d2d313351183e8f6c05d4c7abd76e665",
    "verification": {
      "chatgpt": {
        "evidence": [],
        "status": "not-run"
      },
      "codex": {
        "evidence": [],
        "status": "not-run"
      }
    }
  },
  {
    "adaptationStatus": "adapted-reviewed",
    "dependencies": [],
    "destinationPath": "skills/poteto-mode/scripts/check-plan.test.ts",
    "disposition": "runtime",
    "licenseProvenance": {
      "copyright": "Copyright (c) 2026 Lauren Tan",
      "license": "MIT",
      "sourcePath": "LICENSE"
    },
    "rationale": "Adapt fence regressions to local valid-plan contract and Bun execution.",
    "upstreamCommit": "99743e9c151c8537cbbf1f98bb38f34ef3368453",
    "upstreamPath": "skills/poteto-mode/scripts/check-plan.test.ts",
    "upstreamSha256": "c80f3ea043b81f219b92c4c8a3af6bdd4f8d32ea596ec15b5b9e0252645f2ae8",
    "verification": {
      "chatgpt": {
        "evidence": [],
        "status": "not-run"
      },
      "codex": {
        "evidence": [],
        "status": "not-run"
      }
    }
  },
  {
    "adaptationStatus": "adapted-reviewed",
    "dependencies": [
      "references/host-capabilities.md"
    ],
    "destinationPath": "skills/sharpen/SKILL.md",
    "disposition": "runtime",
    "licenseProvenance": {
      "copyright": "Copyright (c) 2026 Lauren Tan",
      "license": "MIT",
      "sourcePath": "LICENSE"
    },
    "rationale": "Add reviewed upstream native-text workflow with explicit scope, capability and authorization limits; invocation metadata is not host enforcement.",
    "upstreamCommit": "99743e9c151c8537cbbf1f98bb38f34ef3368453",
    "upstreamPath": "skills/sharpen/SKILL.md",
    "upstreamSha256": "6bcd73916696eb9c5b79b6f960983760c34bcc28937c11142dd8d86b5107aa46",
    "verification": {
      "chatgpt": {
        "evidence": [],
        "status": "not-run"
      },
      "codex": {
        "evidence": [],
        "status": "not-run"
      }
    }
  }
]
