[
  {
    "upstreamPath": "skills/principle-prove-it-works/SKILL.md",
    "upstreamCommit": "df581122cde17e6e27686b5a448bde23e4ad4318",
    "upstreamSha256": "ec79a15025bac8d33d62011c54f3b612733fd2a024e623b531b3637aa75070e2",
    "destinationPath": "skills/principle-prove-it-works/SKILL.md",
    "disposition": "runtime",
    "rationale": "Preserve the complete canonical verification principle and invocation metadata; bind artifact inspection, execution and retained evidence to observed session capabilities and authorized scope. No comparison content or personal preferences added.",
    "dependencies": [
      "references/host-capabilities.md",
      "skills/show-me-your-work/SKILL.md"
    ],
    "licenseProvenance": {
      "license": "MIT",
      "copyright": "Copyright (c) 2026 Lauren Tan",
      "sourcePath": "LICENSE"
    },
    "adaptationStatus": "adapted-reviewed",
    "verification": {
      "chatgpt": {
        "status": "not-run",
        "evidence": []
      },
      "codex": {
        "status": "not-run",
        "evidence": []
      }
    }
  }
]
