[
  {
    "adaptationStatus": "adapted-reviewed",
    "dependencies": [
      "skills/arena/SKILL.md",
      "skills/unslop/SKILL.md",
      "references/host-capabilities.md",
      "references/model-roles.md",
      "references/orchestration-contract.md",
      "references/workflow-ownership.md"
    ],
    "destinationPath": "skills/poteto-mode/playbooks/eval.md",
    "disposition": "runtime",
    "licenseProvenance": {
      "copyright": "Copyright (c) 2026 Lauren Tan",
      "license": "MIT",
      "sourcePath": "LICENSE"
    },
    "rationale": "Upstream changes are editorial compression or delegate-effort reminders already governed by shared mode policy. Retain explicit local host, offline audit, authorization and evidence bindings.",
    "upstreamCommit": "e5136d82418d2db3165ea1050d17577cd618cc05",
    "upstreamPath": "skills/poteto-mode/playbooks/eval.md",
    "upstreamSha256": "a93d449a908236afa6645179651844094b1547dbab4e484cffcdda630e4b90bf",
    "verification": {
      "chatgpt": {
        "evidence": [],
        "status": "not-run"
      },
      "codex": {
        "evidence": [],
        "status": "not-run"
      }
    }
  }
]
